{
  "$schema": "https://json-schema.org/draft/2020-12/schema",
  "$id": "https://fluidsbench.org/schemas/v3/evaluation-evidence.schema.json",
  "title": "FluidsBench v3 submitter evaluation evidence",
  "type": "object",
  "additionalProperties": false,
  "required": [
    "$schema",
    "schema_version",
    "submission_id",
    "dataset_id",
    "dataset_version",
    "split_id",
    "split_sha256",
    "case_set_id",
    "reference_version",
    "command",
    "generated_at",
    "status",
    "metric_values",
    "profile_index_sha256",
    "profile_ground_truth_release_id",
    "profile_ground_truth_manifest_sha256",
    "scoring_support_release_id",
    "scoring_support_manifest_sha256",
    "discretization_sha256",
    "case_metrics_sha256"
  ],
  "properties": {
    "$schema": { "const": "https://fluidsbench.org/schemas/v3/evaluation-evidence.schema.json" },
    "schema_version": { "const": "3.0" },
    "submission_id": { "type": "string", "pattern": "^[a-z0-9][a-z0-9-]{2,79}$" },
    "dataset_id": { "type": "string", "pattern": "^[a-z0-9][a-z0-9-]*$" },
    "dataset_version": { "type": "string", "minLength": 1, "maxLength": 160 },
    "split_id": { "$ref": "#/$defs/safe_id" },
    "split_sha256": { "$ref": "#/$defs/sha256" },
    "case_set_id": { "$ref": "#/$defs/safe_id" },
    "prediction_scope": { "enum": ["surface_and_volume", "surface_only"] },
    "reference_version": { "type": "string", "minLength": 1, "maxLength": 160 },
    "code_revision": { "type": "string", "pattern": "^(?:[a-f0-9]{40}|[a-f0-9]{64})$" },
    "dataset_evaluator_binding": {
      "$ref": "#/$defs/dataset_evaluator_binding"
    },
    "compact_profile_implementation_binding": {
      "$ref": "#/$defs/compact_profile_implementation_binding"
    },
    "dimensional_unit_conversion": {
      "type": "object",
      "additionalProperties": false,
      "required": ["contract_id", "contract_sha256", "stage", "input_basis", "output_basis", "application_count"],
      "properties": {
        "contract_id": { "const": "hiliftaeroml-dimensional-export-si-v1" },
        "contract_sha256": { "$ref": "#/$defs/sha256" },
        "stage": { "const": "fluidsbench_package_export" },
        "input_basis": { "const": "solver_native_dimensional" },
        "output_basis": { "const": "SI" },
        "application_count": { "const": 1 }
      }
    },
    "command": { "type": "string", "minLength": 1, "maxLength": 2000 },
    "generated_at": { "type": "string", "format": "date-time" },
    "status": { "const": "submitted_evaluation" },
    "metric_values": {
      "type": "object",
      "minProperties": 1,
      "additionalProperties": { "type": "number" }
    },
    "profile_index_sha256": { "$ref": "#/$defs/sha256" },
    "profile_ground_truth_release_id": { "$ref": "#/$defs/safe_id" },
    "profile_ground_truth_manifest_sha256": { "$ref": "#/$defs/sha256" },
    "scoring_support_release_id": { "$ref": "#/$defs/safe_id" },
    "scoring_support_manifest_sha256": { "$ref": "#/$defs/sha256" },
    "discretization_sha256": { "$ref": "#/$defs/sha256" },
    "case_metrics_sha256": { "$ref": "#/$defs/sha256" },
    "regional_diagnostics_sha256": { "$ref": "#/$defs/sha256" },
    "notes": { "type": "string" }
  },
  "$defs": {
    "sha256": { "type": "string", "pattern": "^[a-f0-9]{64}$" },
    "safe_id": {
      "type": "string",
      "pattern": "^[a-z0-9][a-z0-9._-]{0,159}$"
    },
    "dataset_evaluator_binding": {
      "type": "object",
      "additionalProperties": false,
      "required": ["status", "reference_version", "code_revision"],
      "properties": {
        "status": { "const": "frozen" },
        "reference_version": {
          "type": "string",
          "minLength": 1,
          "maxLength": 160
        },
        "code_revision": {
          "type": "string",
          "pattern": "^(?:[a-f0-9]{40}|[a-f0-9]{64})$"
        }
      }
    },
    "compact_profile_implementation_binding": {
      "type": "object",
      "additionalProperties": false,
      "required": [
        "status",
        "activation_effect",
        "code_revision",
        "implementation_manifest_sha256",
        "base_dataset_evaluator_scope"
      ],
      "properties": {
        "status": { "const": "unbound_worktree_candidate" },
        "activation_effect": { "const": "none" },
        "code_revision": { "type": "null" },
        "implementation_manifest_sha256": { "type": "null" },
        "base_dataset_evaluator_scope": {
          "const": "native_v1_base_field_force_and_noncompact_scoring_only"
        }
      }
    }
  }
}
