{
  "$schema": "https://fluidsbench.org/schemas/v3/evaluation-evidence.schema.json",
  "schema_version": "3.0",
  "submission_id": "hiliftaeroml-geotransolver-scarce-candidate-v1",
  "dataset_id": "hiliftaeroml",
  "dataset_version": "hiliftaeroml-native-v1-candidate",
  "split_id": "scarce",
  "split_sha256": "1c20c8a3079dd99db01146aca9513f14c4129f7f5fc575199901de17f65e012b",
  "case_set_id": "caseset-ac791749e527",
  "prediction_scope": "surface_and_volume",
  "reference_version": "hiliftaeroml-evaluator-v0.1-candidate",
  "dataset_evaluator_binding": {
    "status": "frozen",
    "reference_version": "hiliftaeroml-evaluator-v0.1-candidate",
    "code_revision": "68899f780d96b70f2badb5658971c87af0b17172"
  },
  "command": "python scripts/assemble_hiliftaeroml_schema_v3_candidate.py --config ../hiliftaeroml-geotransolver-submission-v1/release/table5_completion_scarce_schema_v3_20260912/configs/geotransolver-scarce-candidate-config.json --native-aggregate ../hiliftaeroml-geotransolver-submission-v1/aggregates/scarce/aggregate-a --native-surface-outputs ../hiliftaeroml-geotransolver-submission-v1/outputs/scarce --native-volume-outputs ../hiliftaeroml-geotransolver-submission-v1/outputs/scarce --native-receipts ../hiliftaeroml-geotransolver-submission-v1/outputs/receipts/scarce/receipts-a --candidate-compact-profile-support-release ../eval_runs/hilift_compact_profile_support_v2_all1355_candidate_20260907/release/hiliftaeroml-compact-profile-support-v2-candidate --output ../hiliftaeroml-geotransolver-submission-v1/release/table5_completion_scarce_schema_v3_20260912/packages/scarce/package-a",
  "generated_at": "2026-09-12T09:29:41-07:00",
  "status": "submitted_evaluation",
  "metric_values": {
    "overall_score": 36.85558247595453,
    "field_score": 6.656545955214726,
    "force_score": 98.56519680601961,
    "diagnostic_score": 35.544041187369054,
    "surface_pressure_rel_l2": 13.05618144281745,
    "surface_pressure_equal_entity_rel_l2": 12.424835614654242,
    "surface_wall_shear_rel_l2": 20.14528463614233,
    "surface_wall_shear_equal_entity_rel_l2": 21.18424984333532,
    "volume_velocity_rel_l2": 17.36674380199908,
    "volume_pressure_rel_l2": 12.92331836936278,
    "surface_pressure_rel_l1": 11.512528490361063,
    "surface_wall_shear_rel_l1": 16.962767753531068,
    "volume_velocity_rel_l1": 15.12200948544317,
    "volume_pressure_rel_l1": 9.072749183849368,
    "velocity_profile_r2": -0.0966329099609404,
    "cp_cut_r2": 0.8886010296842263,
    "surface_pressure_mae": 137.64346683820156,
    "surface_wall_shear_mae": 0.7924996061769041,
    "volume_velocity_mae": 3.8542036667272384,
    "volume_pressure_mae": 214.7463359571775,
    "surface_pressure_rmse": 248.35815080336195,
    "surface_wall_shear_rmse": 1.5931786692903793,
    "volume_velocity_rmse": 6.475599065796326,
    "volume_pressure_rmse": 414.7028878687101,
    "cd_r2": 0.9925301110041556,
    "cl_r2": 0.9753347536442569,
    "c_drag_mae": 0.008803605911463406,
    "c_lift_mae": 0.031508514392390156,
    "c_pitch_mae": 0.04349782948377356
  },
  "profile_index_sha256": "74bbaeae096dafcf0007b2d9c645195e1eb8b403670cea56350e82ba8484dcdb",
  "profile_ground_truth_release_id": "hiliftaeroml-native-profile-truth-v1-candidate",
  "profile_ground_truth_manifest_sha256": "3e20b857e12055e16f1d248d125b8df62a3669c604411dc67322fe98d9ab4477",
  "scoring_support_release_id": "hiliftaeroml-native-all-splits-support-v1-candidate",
  "scoring_support_manifest_sha256": "98a9a8d015e42c80f5993e30da94201011bebf67ff44d5574a7ef68a8b5dfbee",
  "discretization_sha256": "515f2f23d6e54a50595ef0ffe3e242a23981f841e7a5999b3072101c4cc56e35",
  "case_metrics_sha256": "197a7343d6b12dbad9c3993a4d4f5299ef0651666a5672302c135b2a790a1e3e",
  "notes": "The frozen dataset-evaluator revision 68899f780d96b70f2badb5658971c87af0b17172 applies only to the native-v1 base field, force, and noncompact scoring implementation. The additive compact-v2 profile implementation is an unbound worktree candidate with no code revision or implementation-manifest SHA-256; its profile topology contract is b1fd29b2cb6c1c84c694ddffc5d85f6cd68fd175b79c3695a443aa78bf962c2f. Cp/velocity profile R2 was recomputed from prediction-only chunks against the explicitly supplied inactive local candidate evaluator-support release; this does not publish or activate profile intake. Dimensional field MAE/RMSE is converted from solver-native units to SI by hiliftaeroml-dimensional-export-si-v1; this export stage is separate from the earlier frozen native-evaluator binding. Predictions, relative statistics, profiles, coefficients and composite scores are unchanged.",
  "regional_diagnostics_sha256": "750d445507f1103e2f9563fca000b4590fa8d7e69223cf91aac3cbe83dbb7232",
  "compact_profile_implementation_binding": {
    "status": "unbound_worktree_candidate",
    "activation_effect": "none",
    "code_revision": null,
    "implementation_manifest_sha256": null,
    "base_dataset_evaluator_scope": "native_v1_base_field_force_and_noncompact_scoring_only"
  },
  "dimensional_unit_conversion": {
    "contract_id": "hiliftaeroml-dimensional-export-si-v1",
    "contract_sha256": "a25f25b24228b72b0798704a155745ea5aab40db928e3e27a01904ec868acc59",
    "stage": "fluidsbench_package_export",
    "input_basis": "solver_native_dimensional",
    "output_basis": "SI",
    "application_count": 1
  }
}
